title,price
Пухова куртка Turbat Lofoten Mns,4 950 грн
Пухова куртка Turbat Lofoten Wms,4 950 грн
Куртка Turbat Trek Urban Mns ,3 655 грн2 924 грн
Куртка Turbat Trek Urban Wmn,3 655 грн2 924 грн
Куртка Salewa Puez Clastic 2 Powertex 2L Jacket Mns,6 424 грн
Куртка Salewa Puez Clastic 2 Powertex 2L Jacket Wms,6 424 грн
Куртка Salewa Fanes 2 Powertex/Tirolwool Celliant Mns Jacket,11 824 грн9 459 грн
Куртка Salewa Fanes 2 Powertex/Tirolwool Celliant Wms Parka,11 824 грн9 459 грн
Куртка Salewa Antelao Beltovo Mns,9 459 грн7 567 грн
Куртка Salewa Antelao Beltovo Wms,9 459 грн7 567 грн
Куртка Turbat Isla Wmn,3 395 грн
Пальто Turbat Odda 2,4 650 грн
Куртка Salewa Pelmo Convertible Jacket Mns,8 446 грн
Куртка Salewa Pelmo Convertible Jacket Wms,8 446 грн
Пухова куртка Turbat Trek Mns,4 075 грн
Пухова куртка Turbat Trek Wms,4 075 грн
Куртка Alpine Pro Nootk 8,2 465 грн
Куртка Alpine Pro Nootka 8,2 244 грн
Куртка Salewa Brenta Jacket Mns,7 770 грн
Куртка Salewa Brenta Jacket Wms,7 770 грн
Куртка Salewa Moiazza GTX Mns,7 433 грн
Куртка Salewa Moiazza GTX Wms,7 433 грн
Куртка Turbat Atlas 2 Mns,3 770 грн
Куртка-парка S-cape Mns,6 700 грн6 030 грн
Куртка-парка S-cape Wms,6 700 грн6 030 грн
Безрукавка Mountain Equipment Frostline Vest,4 178 грн
Безрукавка Mountain Equipment Switch Wmns Vest,3 172 грн
Куртка Mountain Equipment Arete Hooded Mns,5 496 грн
Куртка Mountain Equipment Arete Hooded Wms,5 359 грн
Куртка Mountain Equipment Arete Mns,5 063 грн
Куртка Mountain Equipment Superflux,5 728 грн
Плащ-дощовик S-cape Dandelion Mns,3 300 грн2 970 грн
Плащ-дощовик S-cape Dandelion Wms,3 300 грн2 970 грн
Куртка Montane Flux Jacket,6 569 грн
Плащ-дощовик S-cape Bossa Nova Mns,3 400 грн3 060 грн
Плащ-дощовик S-cape Bossa Nova Wms,3 400 грн3 060 грн
Плащ-дощовик S-cape Moonless Night Mns,3 300 грн
Плащ-дощовик S-cape Moonless Night Wms,3 300 грн2 970 грн
Плащ-дощовик S-cape Stormy Sea Mns,3 300 грн2 970 грн
Плащ-дощовик S-cape Stormy Sea Wms,3 300 грн2 970 грн
Плащ-дощовик класичний S-cape Mns,3 000 грн2 700 грн
Куртка Mountain Equipment Skyline Wmns,6 467 грн
Куртка Mountain Equipment Skyline Wmns Down Parka,9 226 грн
Куртка Mountain Equipment Skyline Wmns Down Parka (2020),9 226 грн
Куртка Fjallraven Kiruna Padded Parka Wms,12 240 грн
Куртка Sierra Designs Whitney Wms,5 481 грн
Куртка Mountain Equipment Echo Hooded Softshell ,3 683 грн
Куртка Picture Organic Maova Wms,8 126 грн6 095 грн
Куртка Alpine Pro Idiko 2,1 677 грн
Куртка Sierra Designs Hurricane,3 915 грн
Куртка Sierra Designs Hurricane Wms,3 915 грн
Куртка Alpine Pro Lanka,2 595 грн2 076 грн
Куртка Fjallraven High Coast Hydratic Jacket Mns,8 500 грн
Куртка Fjallraven High Coast Wind Jacket Wms,6 079 грн
Куртка Fjallraven Skogso Jacket Mns,7 820 грн
Куртка Fjallraven Skogso Jacket Wms,7 181 грн
Куртка Picture Organic Averil,9 486 грн7 115 грн
Куртка Picture Organic Horses ,6 086 грн4 565 грн
Куртка Picture Organic Scale Wms,3 706 грн2 594 грн
Куртка Turbat Atlas Wms,3 660 грн2 562 грн
Куртка Turbat Juta Mns,3 250 грн2 600 грн
Пальто Alpine Pro Gynetha,3 195 грн
Куртка Picture Organic Takashima,6 086 грн4 565 грн
Куртка Turbat Juta Wmn,3 250 грн2 600 грн
Куртка Mountain Equipment Earthrise,5 963 грн
Куртка Picture Organic Horace (2020),6 086 грн3 652 грн
Куртка Picture Organic Loonak Wms,5 746 грн4 310 грн
Куртка Picture Organic Murax Wms,6 086 грн4 565 грн
Куртка Picture Organic Parker (2021),5 746 грн3 448 грн
Куртка Alpine Pro Slocano 4 ,1 740 грн1 392 грн
Куртка-пуховик Reima Jord,4 120 грн3 296 грн
Пальто Fjallraven Snow Flake Parka Wms ,14 960 грн
Куртка Mountain Equipment Altai Wmns Parka,11 763 грн
Куртка Mountain Equipment Sigma Down Wmns,12 533 грн
Куртка Mountain Equipment Superflux Wmns,5 311 грн
Куртка Picture Organic Mohe,6 086 грн4 565 грн
Куртка Picture Organic Scape,6 766 грн5 075 грн
Куртка Picture Organic Sperky,9 146 грн6 860 грн
Куртка Alpine Pro Gabriell 5,3 195 грн
Куртка Alpine Pro Gabriella 3,2 475 грн1 238 грн
Куртка Alpine Pro Icyb 7,3 622 грн
Куртка Alpine Pro Idik,2 513 грн
Куртка Fjallraven Greenland Winter Jacket Mns,11 220 грн
Куртка Fjallraven Greenland Winter Parka Wms,13 600 грн
Куртка Fjallraven Skogso Padded Jacket Mns,12 920 грн
Куртка Mountain Equipment Triton Mns,9 552 грн
Куртка Mountain Equipment Triton Wms,9 930 грн
Куртка Turbat Kleva Kap,3 660 грн1 830 грн
Пальто Alpine Pro Edit 2,3 707 грн2 595 грн
Пальто Alpine Pro Omega 4,2 865 грн2 006 грн
Пальто Alpine Pro Priscilla 5 INS.,3 079 грн
Куртка Alpine Pro Sardar 5,6 169 грн
Куртка Alpine Pro Sardaro 4,3 259 грн
Куртка Picture Organic Track,10 846 грн8 135 грн
Куртка Picture Organic U18 Wms,11 186 грн8 390 грн
Куртка Picture Organic U44,11 866 грн8 900 грн
Куртка Picture Organic Zephir,11 866 грн8 900 грн
Куртка Alpine Pro Sardara 3,4 858 грн3 401 грн
Куртка Alpine Pro Sardara 4,5 421 грн3 795 грн
Куртка Trimm Sawa,5 990 грн
Куртка Horsefeathers Ofelia Jacket Wms,5 700 грн3 990 грн
Куртка Picture Organic Kodiak (2020),7 786 грн4 672 грн
Куртка Alpine Pro Idika,2 432 грн1 702 грн
Куртка Alpine Pro Justica 5 Wms,2 838 грн1 419 грн
Куртка Alpine Pro Nootka 7 Wms,2 380 грн1 190 грн
Куртка Alpine Pro Nootko 9 ,1 795 грн898 грн
Куртка Alpine Pro Padrig ,3 073 грн2 458 грн
Куртка Marmot Telford Jacket,10 688 грн7 482 грн
Куртка Trimm Zen,2 700 грн
Куртка Picture Organic Inukee Rev Wms,8 466 грн
Пальто Fjallraven Expedition Long Down Parka Wms,20 400 грн
Куртка Fjallraven Expedition Down Lite Jacket Wms,20 400 грн
Безрукавка пухова Reima Fauna,2 160 грн1 728 грн
Куртка Alpine Pro Sardar 4,5 600 грн3 920 грн
Куртка Trimm Orlando,4 020 грн
Куртка Horsefeathers Herald Jacket Mns,7 950 грн5 565 грн
Куртка Marmot Shadow Jacket,11 550 грн
Куртка Alpine Pro Sardar 3,5 111 грн3 578 грн
Куртка Alpine Pro Nootk 7,2 506 грн1 754 грн
Пальто Alpine Pro Tessa 4 ,3 428 грн2 400 грн
Пухове пальто Marmot Wm's Montreal Сoat,10 260 грн7 182 грн
